username,date,Stock_Name,Ticker,Tweet
camangalarvind,2024-08-15,RELIANCE,RELIANCE.NS,Strong breakout visible in RELIANCE. Go long above 2420. Target 2540. SL 2370.
camangalarvind,2025-02-14,NATIONALUM,NATIONALUM.NS,Nationalum looking extremely bullish here on the weekly charts! Strong metal breakout.
camangalarvind,2025-03-05,HCC,HCC.NS,HCC chart structure looks rock solid above 42. Immediate track for momentum buyers.
SumeetBagadia,2025-03-10,TATA STEEL,TATASTEEL.NS,BUY TATA STEEL near 148. Target 165. Stoploss 139. Positional breakout.
SumeetBagadia,2025-06-14,AXIS BANK,AXISBANK.NS,Axis Bank chart structure looks very strong above 1120. Showing massive bullish momentum.
SumeetBagadia,2025-09-02,WIPRO,WIPRO.NS,BUY WIPRO around 480. Target price 540. Maintain Stoploss at 455. Long-term delivery call.
TradingMarvel,2025-04-20,HDFC BANK,HDFCBANK.NS,NIFTY option buyers look at HDFC Bank. Core structural reversal candle emerging.
TradingMarvel,2025-07-05,POLYCAB,POLYCAB.NS,Breakout alert in POLYCAB! Fresh long entry above 5100. Target positional 5600. SL 4920.
